Producto;Precio;Imagen
ISOTONICA UP GRADE BLUEBERRY 750 CC;$799,89;d:/python/scrapling/imagenes_productos_maxiconsumo\ISOTONICA UP GRADE BLUEBERRY 750 CC.jpg
ISOTONICA UP GRADE FRUTOS ROJOS 750 CC;$799,89;d:/python/scrapling/imagenes_productos_maxiconsumo\ISOTONICA UP GRADE FRUTOS ROJOS 750 CC.jpg
ISOTONICA UP GRADE MANZANA 750 C;$799,89;d:/python/scrapling/imagenes_productos_maxiconsumo\ISOTONICA UP GRADE MANZANA 750 C.jpg
ISOTONICA POWERADE MOUNTAIN BLAST PET 500 CC;$1.149,90;d:/python/scrapling/imagenes_productos_maxiconsumo\ISOTONICA POWERADE MOUNTAIN BLAST PET 50.jpg
ISOTONICA POWERADE MANZANA PET 500 CC;$1.149,90;d:/python/scrapling/imagenes_productos_maxiconsumo\ISOTONICA POWERADE MANZANA PET 500 CC.jpg
ISOTONICA POWERADE MANZANA PET 995 CC;$1.349,90;d:/python/scrapling/imagenes_productos_maxiconsumo\ISOTONICA POWERADE MANZANA PET 995 CC.jpg
ISOTONICA POWERADE MOUNTAIN BLAST PET 995 CC;$1.349,90;d:/python/scrapling/imagenes_productos_maxiconsumo\ISOTONICA POWERADE MOUNTAIN BLAST PET 99.jpg
ISOTONICA GATORADE NARANJA PET 500 CC;$1.399,90;d:/python/scrapling/imagenes_productos_maxiconsumo\ISOTONICA GATORADE NARANJA PET 500 CC.jpg
ISOTONICA GATORADE MANZANA PET 500 CC;$1.399,90;d:/python/scrapling/imagenes_productos_maxiconsumo\ISOTONICA GATORADE MANZANA PET 500 CC.jpg
ISOTONICA GATORADE COOL BLUE PET 500 CC;$1.399,90;d:/python/scrapling/imagenes_productos_maxiconsumo\ISOTONICA GATORADE COOL BLUE PET 500 CC.jpg
