Producto;Precio;Imagen
ISOTONICA UP GRADE BLUEBERRY 750 CC;$879,90;d:/python/scrapling/imagenes_productos_maxiconsumo\ISOTONICA UP GRADE BLUEBERRY 750 CC.jpg
ISOTONICA UP GRADE FRUTOS ROJOS 750 CC;$879,90;d:/python/scrapling/imagenes_productos_maxiconsumo\ISOTONICA UP GRADE FRUTOS ROJOS 750 CC.jpg
ISOTONICA UP GRADE MANZANA 750 C;$879,90;d:/python/scrapling/imagenes_productos_maxiconsumo\ISOTONICA UP GRADE MANZANA 750 C.jpg
ISOTONICA POWERADE MOUNTAIN BLAST PET 500 CC;$1.149,90;d:/python/scrapling/imagenes_productos_maxiconsumo\ISOTONICA POWERADE MOUNTAIN BLAST PET 50.jpg
ISOTONICA GATORADE NARANJA PET 500 CC;$1.399,90;d:/python/scrapling/imagenes_productos_maxiconsumo\ISOTONICA GATORADE NARANJA PET 500 CC.jpg
ISOTONICA GATORADE MANZANA PET 500 CC;$1.399,90;d:/python/scrapling/imagenes_productos_maxiconsumo\ISOTONICA GATORADE MANZANA PET 500 CC.jpg
ISOTONICA GATORADE COOL BLUE PET 500 CC;$1.399,90;d:/python/scrapling/imagenes_productos_maxiconsumo\ISOTONICA GATORADE COOL BLUE PET 500 CC.jpg
ISOTONICA GATORADE UVA PET 500 CC;$1.399,90;d:/python/scrapling/imagenes_productos_maxiconsumo\ISOTONICA GATORADE UVA PET 500 CC.jpg
ISOTONICA GATORADE FRUTAS TROPICALES PET 500 CC;$1.399,90;d:/python/scrapling/imagenes_productos_maxiconsumo\ISOTONICA GATORADE FRUTAS TROPICALES PET.jpg
ISOTONICA GATORADE FRUTOS TROPICALES 750 CC;$1.669,90;d:/python/scrapling/imagenes_productos_maxiconsumo\ISOTONICA GATORADE FRUTOS TROPICALES 750.jpg
