Producto;Precio;Imagen
Medallones Carne Vacuna con Soja x 2 Un. Tres Cruces x 110 g.;$ 1.750;D:/python/scrapling/imagenes_productos_laanonima\Medallones Carne Vacuna con Soja x 2 Un _38.jpg
Medallones de Carne Vacuna Best x 2 un. 110 gr.;$ 2.200;D:/python/scrapling/imagenes_productos_laanonima\Medallones de Carne Vacuna Best x 2 un 1_8.jpg
Medallones de Carne Vacuna Doble Swift x 2 un. 112 gr.;$ 2.300;D:/python/scrapling/imagenes_productos_laanonima\Medallones de Carne Vacuna Doble Swift x_41.jpg
Medallones de Carne Vacuna Express x 2 Un. Paty x 110 g.;$ 2.600;D:/python/scrapling/imagenes_productos_laanonima\Medallones de Carne Vacuna Express x 2 U_6.jpg
Medallones de Carne Vacuna x 2 Un.  Swift x 320 g.;$ 3.050;D:/python/scrapling/imagenes_productos_laanonima\Medallones de Carne Vacuna x 2 Un  Swift_30.jpg
Medallón Hamburguesa Champion. x 4 u. 224 GR;$ 3.300;D:/python/scrapling/imagenes_productos_laanonima\Medallón Hamburguesa Champion x 4 u 224 _37.jpg
Hamburguesa Carne Vacuna Finitas x 2 Un. Paty x 110 g.;$ 3.400;D:/python/scrapling/imagenes_productos_laanonima\Hamburguesa Carne Vacuna Finitas x 2 Un _16.jpg
Hamburguesas de Carne Vacuna La Anónima x 2 un. 110 gr.;$ 3.450;D:/python/scrapling/imagenes_productos_laanonima\Hamburguesas de Carne Vacuna La Anónima _10.jpg
Medallones de Carne Vacuna x 4 un. La Blanca x 276 gr.;$ 4.100;D:/python/scrapling/imagenes_productos_laanonima\Medallones de Carne Vacuna x 4 un La Bla_32.jpg
Hamburguesa de Carne Vacuna Clásica Doble Plus Swift x 2 un. 160 gr.;$ 4.250;D:/python/scrapling/imagenes_productos_laanonima\Hamburguesa de Carne Vacuna Clásica Dobl_28.jpg
