Producto;Precio;Imagen
Fibra Esponja con Cuadraditos Best x 1 un.;$ 640;D:/python/scrapling/imagenes_productos_laanonima\Fibra Esponja con Cuadraditos Best x 1 u_58.jpg
Fibra Esponja Lisita Best x 1 un.;$ 800;D:/python/scrapling/imagenes_productos_laanonima\Fibra Esponja Lisita Best x 1 un_73.jpg
Fibra Esponja Best Extra Delgada x 1 un.;$ 870;D:/python/scrapling/imagenes_productos_laanonima\Fibra Esponja Best Extra Delgada x 1 un_75.jpg
Esponja de Acero Best x 1 un.;$ 1.000;D:/python/scrapling/imagenes_productos_laanonima\Esponja de Acero Best x 1 un_20.jpg
Rejilla Blanca Best Pábilo 32x42cm x 1 un.;$ 1.050;D:/python/scrapling/imagenes_productos_laanonima\Rejilla Blanca Best Pábilo 32x42cm x 1 u_64.jpg
Fibra Esponja Suave Best No raya x 1 un.;$ 1.100;D:/python/scrapling/imagenes_productos_laanonima\Fibra Esponja Suave Best No raya x 1 un_127.jpg
Jabón en Pan Blanco Best x 1 un. x 200 g.;$ 1.300;D:/python/scrapling/imagenes_productos_laanonima\Jabón en Pan Blanco Best x 1 un x 200 g_21.jpg
Rejilla Blanca Best Americana 38x43cm x 1 un.;$ 1.300;D:/python/scrapling/imagenes_productos_laanonima\Rejilla Blanca Best Americana 38x43cm x _57.jpg
Esponja de Acero Best x 2 un.;$ 1.350;D:/python/scrapling/imagenes_productos_laanonima\Esponja de Acero Best x 2 un_54.jpg
Limpiador Líquido para Pisos Best Fragancia Lavanda x 900 cc.;$ 1.350;D:/python/scrapling/imagenes_productos_laanonima\Limpiador Líquido para Pisos Best Fragan_62.jpg
