Producto;Precio;Imagen
Aceite Mezcla Siglo de Oro x 900 cc.;$ 2.950;No disponible
Aceite Mezcla Cocinero x 900 cc.;$ 3.100;No disponible
Aceite de Girasol Legitimo x 900 cc.;$ 3.750;No disponible
Aceite de Girasol Cañuelas x 900 cc.;$ 3.950;No disponible
Aceite de Girasol Pureza x 900 cc.;$ 4.000;No disponible
Aceite de Girasol Natura x 900 cc.;$ 4.150;No disponible
Aceite de Girasol Cocinero x 900 cc.;$ 4.150;No disponible
Rocio Vegetal sin Manteca con Harina Mama Cocina x 150 cc.;$ 4.150;No disponible
Rocío Vegetal La Anónima x 120 g.;$ 4.400;No disponible
Aceite de Girasol La Anónima x 900 cc.;$ 4.550;No disponible
