Producto;Precio;Imagen
Servilletas Papel Hoja Simple 32,3 cm x 30 cm Felpita x 70 Un.;$ 1.550;D:/python/scrapling/imagenes_productos_laanonima\Servilletas Papel Hoja Simple 323 cm x 3_6.jpg
Servilleta Sussex Clásica hoja simple 80 un;$ 1.800;D:/python/scrapling/imagenes_productos_laanonima\Servilleta Sussex Clásica hoja simple 80_4.jpg
Servilletas Papel 33X33 Elegante x 80 un.;$ 1.800;D:/python/scrapling/imagenes_productos_laanonima\Servilletas Papel 33X33 Elegante x 80 un_11.jpg
Servilletas Papel Tissue La Anónima Decoradas 32cmx30cm x 70 un.;$ 1.900;D:/python/scrapling/imagenes_productos_laanonima\Servilletas Papel Tissue La Anónima Deco_24.jpg
Servilletas La Anónima x 80 un.;$ 2.150;D:/python/scrapling/imagenes_productos_laanonima\Servilletas La Anónima x 80 un_12.jpg
Bolsas para Residuos Best 45x55cm x 20 un.;$ 2.200;D:/python/scrapling/imagenes_productos_laanonima\Bolsas para Residuos Best 45x55cm x 20 u_18.jpg
Papel Higiénico Hoja Simple Elegante 30 Mts Blanco x 4 un.;$ 2.400;D:/python/scrapling/imagenes_productos_laanonima\Papel Higiénico Hoja Simple Elegante 30 _37.jpg
Papel higiénico Higienol Fresh hoja simple 30 m 4 un;$ 2.450;D:/python/scrapling/imagenes_productos_laanonima\Papel higiénico Higienol Fresh hoja simp_34.jpg
Papel Higiénico Higienol Plus Doble Hoja 20 M 4 Un.;$ 2.450;D:/python/scrapling/imagenes_productos_laanonima\Papel Higiénico Higienol Plus Doble Hoja_41.jpg
Papel Higiénico Hoja Simple Best 4 x 30 metros;$ 2.700;D:/python/scrapling/imagenes_productos_laanonima\Papel Higiénico Hoja Simple Best 4 x 30 _21.jpg
