Producto;Precio;Imagen
Pulpa de Manzana&Durazno Pouch Zummy x 110 g.;$ 1.500;D:/python/scrapling/imagenes_productos_laanonima\Pulpa de ManzanaDurazno Pouch Zummy x 11_0.jpg
Pulpa de Manzana Pouch Zummy x 110 g.;$ 1.500;D:/python/scrapling/imagenes_productos_laanonima\Pulpa de Manzana Pouch Zummy x 110 g_1.jpg
Pulpa de Pera Pouch Zummy x 110 g.;$ 1.500;D:/python/scrapling/imagenes_productos_laanonima\Pulpa de Pera Pouch Zummy x 110 g_2.jpg
Pulpa de Ciruela Desecada Pouch Zummy x 110 g.;$ 1.500;D:/python/scrapling/imagenes_productos_laanonima\Pulpa de Ciruela Desecada Pouch Zummy x _3.jpg
Leche LV Modificada Etapa 4 Profutura Nutrilón x 200 cc.;$ 2.650;D:/python/scrapling/imagenes_productos_laanonima\Leche LV Modificada Etapa 4 Profutura Nu_4.jpg
Formula Lactea LV Etapa 2 Profutura Nutrilón x 200 cc.;$ 2.950;D:/python/scrapling/imagenes_productos_laanonima\Formula Lactea LV Etapa 2 Profutura Nutr_20.jpg
NESTUM® Multicereal x 225gr;$ 7.050;D:/python/scrapling/imagenes_productos_laanonima\NESTUM Multicereal x 225gr_10.jpg
NESTUM® Trigo y Miel x 225gr;$ 7.050;D:/python/scrapling/imagenes_productos_laanonima\NESTUM Trigo y Miel x 225gr_11.jpg
NESTUM® Arroz x 225gr;$ 7.250;D:/python/scrapling/imagenes_productos_laanonima\NESTUM Arroz x 225gr_8.jpg
NIDO® 4 PREBIO 3 Leche en Polvo x 800gr;$ 19.200;D:/python/scrapling/imagenes_productos_laanonima\NIDO 4 PREBIO 3 Leche en Polvo x 800gr_15.jpg
