Producto;Precio;Imagen
Aderezo Rallado Sabor Queso Best x 40 g.;$ 960;D:/python/scrapling/imagenes_productos_laanonima\Aderezo Rallado Sabor Queso Best x 40 g_7.jpg
Queso Rallado La Quesera x 40 g.;$ 970;D:/python/scrapling/imagenes_productos_laanonima\Queso Rallado La Quesera x 40 g_23.jpg
Queso Rallado Reggianito La Serenísima x 35 g.;$ 1.800;D:/python/scrapling/imagenes_productos_laanonima\Queso Rallado Reggianito La Serenísima x_57.jpg
Queso Rallado Tregar x 40 g.;$ 2.200;D:/python/scrapling/imagenes_productos_laanonima\Queso Rallado Tregar x 40 g_1.jpg
Aderezo Rallado Sabor Queso Best x 100 g.;$ 2.350;D:/python/scrapling/imagenes_productos_laanonima\Aderezo Rallado Sabor Queso Best x 100 g_9.jpg
Queso Provolone En Fetas x 8 Un. Tonadita x 120 g.;$ 2.800;D:/python/scrapling/imagenes_productos_laanonima\Queso Provolone En Fetas x 8 Un Tonadita_28.jpg
Queso Cheddar En Fetas x 8 Un. Tonadita x 120 g.;$ 2.800;D:/python/scrapling/imagenes_productos_laanonima\Queso Cheddar En Fetas x 8 Un Tonadita x_35.jpg
Queso en Hebras Mini La Paulina x 80 g.;$ 3.050;D:/python/scrapling/imagenes_productos_laanonima\Queso en Hebras Mini La Paulina x 80 g_63.jpg
Queso de Cerdo Feteado 42 x 200 g.;$ 3.300;D:/python/scrapling/imagenes_productos_laanonima\Queso de Cerdo Feteado 42 x 200 g_110.jpg
Queso Rallado Reggianito La Serenísima x 70 g.;$ 3.450;D:/python/scrapling/imagenes_productos_laanonima\Queso Rallado Reggianito La Serenísima x_33.jpg
