Producto;Precio;Imagen
Pañales Huggies Classic P x30;$ 12.500;No disponible
Pañal Huggies Flexi Comfort XG x16;$ 14.300;No disponible
Pañal Huggies Flexi Comfort G x20;$ 14.300;No disponible
Pañales Babysec Super Premium Recien Nacido 20 Un.;$ 14.300;No disponible
Traje Baño M Little Swimm Huggies x 11 un.;$ 14.550;No disponible
Pañal Huggies Protect Plus P x30;$ 14.600;No disponible
Traje de Baño Descremado  Splashers G-XG Pampers x 10 un.;$ 16.350;No disponible
Traje de Baño Descremado  Splashers P-M Pampers x 12 un.;$ 16.350;No disponible
Traje de Baño Descremado  Splashers M-G Pampers x 11 un.;$ 16.350;No disponible
Pañal Huggies Flexi Comfort P x30;$ 17.150;No disponible
