Producto;Precio;Imagen
Limpiador Líquido Concentrado Lavanda Rinde 1 Lt. Best x 30 cc.;$ 660;D:/python/scrapling/imagenes_productos_laanonima\Limpiador Líquido Concentrado Lavanda Ri.jpg
Limpiador Líquido Concentrado Cherry Rinde 1 Lt. Best x 30 cc.;$ 660;D:/python/scrapling/imagenes_productos_laanonima\Limpiador Líquido Concentrado Cherry Rin.jpg
Limpiador Líquido Concentrado Marina Rinde 1 Lt. Best x 30 cc.;$ 660;D:/python/scrapling/imagenes_productos_laanonima\Limpiador Líquido Concentrado Marina Rin.jpg
Fibra Esponja con Cuadraditos Best x 1 un.;$ 770;D:/python/scrapling/imagenes_productos_laanonima\Fibra Esponja con Cuadraditos Best x 1 u.jpg
Jabón en Pan Blanco Blancura Extrema Argentino x 150 g.;$ 780;D:/python/scrapling/imagenes_productos_laanonima\Jabón en Pan Blanco Blancura Extrema Arg.jpg
Esponja Cuadros Clásica Go La Gauchita x 1 Un.;$ 860;D:/python/scrapling/imagenes_productos_laanonima\Esponja Cuadros Clásica Go La Gauchita x.jpg
Fibra Esponja Lisita Best x 1 un.;$ 890;D:/python/scrapling/imagenes_productos_laanonima\Fibra Esponja Lisita Best x 1 un.jpg
Limpiador Liquido Baño Concentrado Multimax x 100 cc.;$ 980;D:/python/scrapling/imagenes_productos_laanonima\Limpiador Liquido Baño Concentrado Multi.jpg
Fibra Esponja Best Extra Delgada x 1 un.;$ 1.000;D:/python/scrapling/imagenes_productos_laanonima\Fibra Esponja Best Extra Delgada x 1 un.jpg
Fibra Esponja Lisa Virulana x 1 un.;$ 1.100;D:/python/scrapling/imagenes_productos_laanonima\Fibra Esponja Lisa Virulana x 1 un.jpg
