Producto;Precio;Imagen
Carne Picada Envasado al Vacío Best x 500 g.;$ 7.980;D:/python/scrapling/imagenes_productos_laanonima\Carne Picada Envasado al Vacío Best x 50_0.jpg
Carne Picada E/V Estancias LA x 500 g.;$ 10.210;D:/python/scrapling/imagenes_productos_laanonima\Carne Picada EV Estancias LA x 500 g_1.jpg
Preparado para Medallones Estancias La x 500 g.;$ 11.740;D:/python/scrapling/imagenes_productos_laanonima\Preparado para Medallones Estancias La x_6.jpg
Carne Picada M. E/V Estancias LA x 500 g.;$ 12.790;D:/python/scrapling/imagenes_productos_laanonima\Carne Picada M EV Estancias LA x 500 g_2.jpg
Tapa de Bife Envasado al Vacío FB MEATS (Kg);$ 12.990;D:/python/scrapling/imagenes_productos_laanonima\Tapa de Bife Envasado al Vacío FB MEATS _8.jpg
Asado C/hueso Congelado FB MEATS (Kg);$ 13.490;No disponible
Matambre Envasado al Vacío FB MEATS (Kg);$ 13.990;D:/python/scrapling/imagenes_productos_laanonima\Matambre Envasado al Vacío FB MEATS Kg_16.jpg
Chingolo Envasado al Vacío FB MEATS (Kg);$ 13.990;D:/python/scrapling/imagenes_productos_laanonima\Chingolo Envasado al Vacío FB MEATS Kg_22.jpg
Vacío Envasado al Vacío FB MEATS (Kg);$ 14.990;D:/python/scrapling/imagenes_productos_laanonima\Vacío Envasado al Vacío FB MEATS Kg_4.jpg
Tapa de Nalga FB MEATS Envasado al Vacío;$ 14.990;D:/python/scrapling/imagenes_productos_laanonima\Tapa de Nalga FB MEATS Envasado al Vacío_33.jpg
