Producto;Precio;Imagen
Pañales Babysec Super Premium Recien Nacido 20 Un.;$ 14.300;D:/python/scrapling/imagenes_productos_laanonima\Pañales Babysec Super Premium Recien Nac.jpg
Pañal Huggies Flexi Comfort XG x16;$ 14.300;D:/python/scrapling/imagenes_productos_laanonima\Pañal Huggies Flexi Comfort XG x16.jpg
Traje Baño M Little Swimm Huggies x 11 un.;$ 14.550;D:/python/scrapling/imagenes_productos_laanonima\Traje Baño M Little Swimm Huggies x 11 u.jpg
Traje de Baño Descremado  Splashers M-G Pampers x 11 un.;$ 16.350;D:/python/scrapling/imagenes_productos_laanonima\Traje de Baño Descremado  Splashers M-G .jpg
Traje de Baño Descremado  Splashers P-M Pampers x 12 un.;$ 16.350;D:/python/scrapling/imagenes_productos_laanonima\Traje de Baño Descremado  Splashers P-M .jpg
Traje de Baño Descremado  Splashers G-XG Pampers x 10 un.;$ 16.350;D:/python/scrapling/imagenes_productos_laanonima\Traje de Baño Descremado  Splashers G-XG.jpg
Pañal Huggies Flexi Comfort P x30;$ 17.150;D:/python/scrapling/imagenes_productos_laanonima\Pañal Huggies Flexi Comfort P x30.jpg
Pañal XXG Classic Huggies x 30 Un.;$ 17.500;D:/python/scrapling/imagenes_productos_laanonima\Pañal XXG Classic Huggies x 30 Un.jpg
Pañal Huggies Classic G x36;$ 17.500;D:/python/scrapling/imagenes_productos_laanonima\Pañal Huggies Classic G x36.jpg
Pañal XG Classic Huggies x 30 Un.;$ 17.500;D:/python/scrapling/imagenes_productos_laanonima\Pañal XG Classic Huggies x 30 Un.jpg
