Producto;Precio;Imagen
Carne Picada Envasado al Vacío Best x 500 g.;$ 7.980;D:/python/scrapling/imagenes_productos_laanonima\Carne Picada Envasado al Vacío Best x 50.jpg
Carne Picada E/V Estancias LA x 500 g.;$ 10.210;D:/python/scrapling/imagenes_productos_laanonima\Carne Picada EV Estancias LA x 500 g.jpg
Preparado para Medallones Estancias La x 500 g.;$ 11.740;D:/python/scrapling/imagenes_productos_laanonima\Preparado para Medallones Estancias La x.jpg
Carne Picada M. E/V Estancias LA x 500 g.;$ 12.790;D:/python/scrapling/imagenes_productos_laanonima\Carne Picada M EV Estancias LA x 500 g.jpg
Tapa de Bife Envasado al Vacío FB MEATS (Kg);$ 13.490;D:/python/scrapling/imagenes_productos_laanonima\Tapa de Bife Envasado al Vacío FB MEATS .jpg
Asado C/hueso Congelado FB MEATS (Kg);$ 13.490;D:/python/scrapling/imagenes_productos_laanonima\Asado Chueso Congelado FB MEATS Kg.jpg
Matambre Envasado al Vacío FB MEATS (Kg);$ 14.490;D:/python/scrapling/imagenes_productos_laanonima\Matambre Envasado al Vacío FB MEATS Kg.jpg
Chingolo Envasado al Vacío FB MEATS (Kg);$ 14.490;D:/python/scrapling/imagenes_productos_laanonima\Chingolo Envasado al Vacío FB MEATS Kg.jpg
Vacío Envasado al Vacío FB MEATS (Kg);$ 15.490;D:/python/scrapling/imagenes_productos_laanonima\Vacío Envasado al Vacío FB MEATS Kg.jpg
Tapa de Nalga FB MEATS Envasado al Vacío;$ 15.490;D:/python/scrapling/imagenes_productos_laanonima\Tapa de Nalga FB MEATS Envasado al Vacío.jpg
