Producto;Precio;Fecha;Imagen
Carne Picada Envasado al Vacío Best x 500 g.;$ 7.980;2026-07-19 12:31:58;d:/proyecto_supermercados_paginaweb/images/laanonima\Carne_Picada_Envasado_al_Vacío_Best_x_500_g.jpg
Carne Picada E/V Estancias LA x 500 g.;$ 10.210;2026-07-19 12:31:58;d:/proyecto_supermercados_paginaweb/images/laanonima\Carne_Picada_EV_Estancias_LA_x_500_g.jpg
Carne Picada M. E/V Estancias LA x 500 g.;$ 12.790;2026-07-19 12:31:58;d:/proyecto_supermercados_paginaweb/images/laanonima\Carne_Picada_M._EV_Estancias_LA_x_500_g.jpg
Milanesa de Carne Congelada La Anónima (Kg);$ 14.290;2026-07-19 12:31:58;d:/proyecto_supermercados_paginaweb/images/laanonima\Milanesa_de_Carne_Congelada_La_Anónima_(Kg).jpg
Asado con Hueso Congelado Estancias La Anónima (Kg);$ 16.490;2026-07-19 12:31:58;d:/proyecto_supermercados_paginaweb/images/laanonima\Asado_con_Hueso_Congelado_Estancias_La_Anónima_(Kg).jpg
Tapa de Asado Best (Kg);$ 16.990;2026-07-19 12:31:58;d:/proyecto_supermercados_paginaweb/images/laanonima\Tapa_de_Asado_Best_(Kg).jpg
Tapa de Asado Envasado al Vacio Estancias La Anónima (Kg);$ 18.990;2026-07-19 12:31:58;d:/proyecto_supermercados_paginaweb/images/laanonima\Tapa_de_Asado_Envasado_al_Vacio_Estancias_La_Anónima_(Kg).jpg
Matambre Congelado Estancias La Anónima (Kg);$ 18.990;2026-07-19 12:31:58;d:/proyecto_supermercados_paginaweb/images/laanonima\Matambre_Congelado_Estancias_La_Anónima_(Kg).jpg
Nalga s/ Tapa Feteada E/V Best (Kg);$ 22.410;2026-07-19 12:31:58;d:/proyecto_supermercados_paginaweb/images/laanonima\Nalga_s_Tapa_Feteada_EV_Best_(Kg).jpg
Peceto Feteado E/V Best (Kg);$ 24.090;2026-07-19 12:31:58;d:/proyecto_supermercados_paginaweb/images/laanonima\Peceto_Feteado_EV_Best_(Kg).jpg
