Producto;Precio;Fecha;Imagen
Carne Picada Envasado al Vacío Best x 500 g.;$ 7.980;2026-06-25 19:42:13;D:/python/scrapling/imagenes_productos_laanonima\Carne_Picada_Envasado_al_Vacío_Best_x_500_g.jpg
Carne Picada E/V Estancias LA x 500 g.;$ 10.210;2026-06-25 19:42:13;D:/python/scrapling/imagenes_productos_laanonima\Carne_Picada_EV_Estancias_LA_x_500_g.jpg
Preparado para Medallones Estancias La x 500 g.;$ 11.740;2026-06-25 19:42:13;D:/python/scrapling/imagenes_productos_laanonima\Preparado_para_Medallones_Estancias_La_x_500_g.jpg
Carne Picada M. E/V Estancias LA x 500 g.;$ 12.790;2026-06-25 19:42:13;D:/python/scrapling/imagenes_productos_laanonima\Carne_Picada_M._EV_Estancias_LA_x_500_g.jpg
Matambre Envasado al Vacío FB MEATS (Kg);$ 14.890;2026-06-25 19:42:13;D:/python/scrapling/imagenes_productos_laanonima\Matambre_Envasado_al_Vacío_FB_MEATS_(Kg).jpg
Tapa de Asado Best (Kg);$ 18.050;2026-06-25 19:42:13;D:/python/scrapling/imagenes_productos_laanonima\Tapa_de_Asado_Best_(Kg).jpg
Carnaza de Paleta Fraccionada/F E/V Best (Kg);$ 18.070;2026-06-25 19:42:13;D:/python/scrapling/imagenes_productos_laanonima\Carnaza_de_Paleta_FraccionadaF_EV_Best_(Kg).jpg
Roast Beef Fraccionado/F E/V Best (Kg);$ 18.380;2026-06-25 19:42:13;D:/python/scrapling/imagenes_productos_laanonima\Roast_Beef_FraccionadoF_EV_Best_(Kg).jpg
Matambre Envasado al Vacío Best (Kg);$ 20.640;2026-06-25 19:42:13;D:/python/scrapling/imagenes_productos_laanonima\Matambre_Envasado_al_Vacío_Best_(Kg).jpg
Vacío E/V Best (Kg);$ 20.860;2026-06-25 19:42:13;D:/python/scrapling/imagenes_productos_laanonima\Vacío_EV_Best_(Kg).jpg
