Producto;Precio;Imagen
Cuarto Trasero de Pollo Fresco;$3.799;D:/python/scrapling/imagenes_productos_vea\Cuarto Trasero de Pollo Fresco_0.jpg
Pollo Congelado Con Menudos;$3.999;D:/python/scrapling/imagenes_productos_vea\Pollo Congelado Con Menudos_2.jpg
Pollo Entero con Menudos 1,8 Kg;$4.299;D:/python/scrapling/imagenes_productos_vea\Pollo Entero con Menudos 18 Kg_3.jpg
Pollo Parrillero;$4.999;D:/python/scrapling/imagenes_productos_vea\Pollo Parrillero_6.jpg
Muslo de Pollo Fresco;$6.699;D:/python/scrapling/imagenes_productos_vea\Muslo de Pollo Fresco_4.jpg
Pata De Pollo;$7.999;D:/python/scrapling/imagenes_productos_vea\Pata De Pollo_5.jpg
Suprema De Pollo Granel Fresca;$11.990;D:/python/scrapling/imagenes_productos_vea\Suprema De Pollo Granel Fresca_1.jpg
Pavita Sadia X Kg;$13.749;D:/python/scrapling/imagenes_productos_vea\Pavita Sadia X Kg_7.jpg
