Producto;Precio;Imagen
Leche En Polvo Descremada La Serenisima 200 Gr;$3.550;D:/python/scrapling/imagenes_productos_vea\Leche En Polvo Descremada La Serenisima _15.jpg
Leche Condensada 395 Grs Cuisine & Co;$4.450;D:/python/scrapling/imagenes_productos_vea\Leche Condensada 395 Grs Cuisine  Co_3.jpg
Leche Polvo Fortigrow 200 Grs Nido®;$4.700;D:/python/scrapling/imagenes_productos_vea\Leche Polvo Fortigrow 200 Grs Nido_10.jpg
Leche Condensada Orgánica 395 Grs Nestlé®;$5.100;D:/python/scrapling/imagenes_productos_vea\Leche Condensada Orgánica 395 Grs Nestlé_1.jpg
Leche Condensada Descremada Orgánica 395 Grs Nestlé®;$5.100;D:/python/scrapling/imagenes_productos_vea\Leche Condensada Descremada Orgánica 395_17.jpg
Leche En Polvo Modificada Armonia 400 Gr;$5.850;D:/python/scrapling/imagenes_productos_vea\Leche En Polvo Modificada Armonia 400 Gr_19.jpg
Leche En Polvo Descremada 400 Grs Cuisine & Co;$6.650;D:/python/scrapling/imagenes_productos_vea\Leche En Polvo Descremada 400 Grs Cuisin_6.jpg
Leche Polvo 0 Porciento Lactosa 350 Grs Svelty®;$6.825;D:/python/scrapling/imagenes_productos_vea\Leche Polvo 0 Porciento Lactosa 350 Grs _8.jpg
Leche En Polvo Purisima 0grasa Deslactosada;$6.850;D:/python/scrapling/imagenes_productos_vea\Leche En Polvo Purisima 0grasa Deslactos_5.jpg
Leche En Polvo Descremada La Serenisima 400 Gr;$7.100;D:/python/scrapling/imagenes_productos_vea\Leche En Polvo Descremada La Serenisima _12.jpg
