Producto;Precio;Imagen
Alimento para Perros Orgánico Sabor Carne, Pollo y Cerdo Adultos 1.5 Kg Sabrositos;$3.850;D:/python/scrapling/imagenes_productos_vea\Alimento para Perros Orgánico Sabor Carn_8.jpg
Snacks Dentastix Razas Mediano Cuidado Oral;$3.900;D:/python/scrapling/imagenes_productos_vea\Snacks Dentastix Razas Mediano Cuidado O_9.jpg
Alimento para Perros Seco Saborizado Adultos Medianos y Grandes 1,5 Kg Dog Chow;$4.125;D:/python/scrapling/imagenes_productos_vea\Alimento para Perros Seco Saborizado Adu_1.jpg
Alimento para Perros Seco Saborizado Adulto Mini y Pequeño 1,5 Kg Dog Chow;$5.287,5;D:/python/scrapling/imagenes_productos_vea\Alimento para Perros Seco Saborizado Adu_15.jpg
Alimento para Perros Seco Sabor Carnes, Cereales y Vegetales Cachorro 3 Kg Sabrositos;$8.750;D:/python/scrapling/imagenes_productos_vea\Alimento para Perros Seco Sabor Carnes C_17.jpg
Alimento Para Perros Pedigree Adulto Mayor 3 Kg;$9.262,5;D:/python/scrapling/imagenes_productos_vea\Alimento Para Perros Pedigree Adulto May_14.jpg
Alimento para Perros Seco Saborizado Adultos 3 Kg Dogui;$9.650;D:/python/scrapling/imagenes_productos_vea\Alimento para Perros Seco Saborizado Adu_2.jpg
Alimento para Perros Seco Sabor Carne y Vegetales Adultos Razas Pequeñas 3 Kg Pedigree;$9.675;D:/python/scrapling/imagenes_productos_vea\Alimento para Perros Seco Sabor Carne y _12.jpg
Alimento para Perros Seco Sabor Carne, Pollo, Verdura y Leche Cachorros 3 Kg Dog Chow;$10.837,5;D:/python/scrapling/imagenes_productos_vea\Alimento para Perros Seco Sabor Carne Po_18.jpg
Alimento para Perros Seco Saborizado Cachorros Pequeños 3 Kg Dog Chow;$11.362,5;D:/python/scrapling/imagenes_productos_vea\Alimento para Perros Seco Saborizado Cac_16.jpg
