Producto;Precio;Imagen
Medallones De Carne Aliada 2 U 110 G;$2.159,00;D:/python/scrapling/imagenes_productos_chango\Medallones De Carne Aliada 2 U 110 G_18.jpg
Medallon De Carne Vacuna Express 110 G 2u;$2.379,00;D:/python/scrapling/imagenes_productos_chango\Medallon De Carne Vacuna Express 110 G 2_11.jpg
Medallones De Merluza Grangys Con Espinaca Y Queso 430 G;$2.554,30;D:/python/scrapling/imagenes_productos_chango\Medallones De Merluza Grangys Con Espina_16.jpg
Medallón Green Life De Calabaza Y Choclo 380 G 4u;$3.574,35;D:/python/scrapling/imagenes_productos_chango\Medallón Green Life De Calabaza Y Choclo_17.jpg
Medallón Green Life De Lentejas Y Zanahorias 380 G 4u;$3.574,35;D:/python/scrapling/imagenes_productos_chango\Medallón Green Life De Lentejas Y Zanaho_19.jpg
Medallones Swift De Carne 276g 4u;$4.116,75;D:/python/scrapling/imagenes_productos_chango\Medallones Swift De Carne 276g 4u_6.jpg
Medallones De Carne Vacuna Paty Express 276 G 4u;$5.789,00;D:/python/scrapling/imagenes_productos_chango\Medallones De Carne Vacuna Paty Express _7.jpg
Hamburguesas De Carne Vacuna Paty Te Quiero 288 G 4u;$5.946,75;D:/python/scrapling/imagenes_productos_chango\Hamburguesas De Carne Vacuna Paty Te Qui_13.jpg
Medallones Granja Del Sol De Pollo 4 U;$6.006,75;D:/python/scrapling/imagenes_productos_chango\Medallones Granja Del Sol De Pollo 4 U_8.jpg
Hamburguesas Paty Clásico 320 G 4u;$6.666,75;D:/python/scrapling/imagenes_productos_chango\Hamburguesas Paty Clásico 320 G 4u_2.jpg
