Producto;Precio;Imagen
Esponja Cocina Alwaid  Glow 1un;$669,00;D:/python/scrapling/imagenes_productos_chango\Esponja Cocina Alwaid  Glow 1un_18.jpg
Esponja Clasica  Glow 1un;$689,00;D:/python/scrapling/imagenes_productos_chango\Esponja Clasica  Glow 1un_6.jpg
Esponja De Acero Inoxidable Mortimer 1 Un;$748,30;D:/python/scrapling/imagenes_productos_chango\Esponja De Acero Inoxidable Mortimer 1 U_3.jpg
Esponja Mortimer Cuadriculada 1un;$797,30;D:/python/scrapling/imagenes_productos_chango\Esponja Mortimer Cuadriculada 1un_8.jpg
Esponja Check Ultrafina 1un;$809,00;D:/python/scrapling/imagenes_productos_chango\Esponja Check Ultrafina 1un_14.jpg
Esponja Mortimer Cuadriculada Antibacterial 1 Un;$832,30;D:/python/scrapling/imagenes_productos_chango\Esponja Mortimer Cuadriculada Antibacter_0.jpg
Esponja Multiuso Virulana 1 U;$859,00;D:/python/scrapling/imagenes_productos_chango\Esponja Multiuso Virulana 1 U_7.jpg
Esponja Sed Metal Hogar Acero Inoxidable;$889,00;D:/python/scrapling/imagenes_productos_chango\Esponja Sed Metal Hogar Acero Inoxidable_4.jpg
Esponja Fibra C/ Cuadraditos 1un;$949,00;D:/python/scrapling/imagenes_productos_chango\Esponja Fibra C Cuadraditos 1un_1.jpg
Esponja Vajilla Inoxidable Virulana 1 U;$999,00;D:/python/scrapling/imagenes_productos_chango\Esponja Vajilla Inoxidable Virulana 1 U_5.jpg
