Producto;Precio;Imagen
Jugo En Polvo Tang Naranja Dulce 15 G;$339,33;D:/python/scrapling/imagenes_productos_chango\Jugo En Polvo Tang Naranja Dulce 15 G_5.jpg
Jugo En Polvo Tang Naranja Mango 15 G;$339,33;D:/python/scrapling/imagenes_productos_chango\Jugo En Polvo Tang Naranja Mango 15 G_6.jpg
Jugo En Polvo Tang Multifruta 15 G;$339,33;D:/python/scrapling/imagenes_productos_chango\Jugo En Polvo Tang Multifruta 15 G_11.jpg
Jugo En Polvo Tang Limonada Dulce 15 G;$339,33;D:/python/scrapling/imagenes_productos_chango\Jugo En Polvo Tang Limonada Dulce 15 G_13.jpg
Jugo En Polvo Tang  Manzana 15 G;$339,33;D:/python/scrapling/imagenes_productos_chango\Jugo En Polvo Tang  Manzana 15 G_14.jpg
Jugo En Polvo Tang Sabor Pera 15 G;$339,33;D:/python/scrapling/imagenes_productos_chango\Jugo En Polvo Tang Sabor Pera 15 G_21.jpg
Jugo En Polvo Tang Pomelo Rosado 15 G;$339,33;D:/python/scrapling/imagenes_productos_chango\Jugo En Polvo Tang Pomelo Rosado 15 G_22.jpg
Jugo En Polvo En Polvo Tang Uva 15 G;$339,33;D:/python/scrapling/imagenes_productos_chango\Jugo En Polvo En Polvo Tang Uva 15 G_23.jpg
Jugo En Polvo Mango Y Naranja Bc 7 Gr;$345,00;D:/python/scrapling/imagenes_productos_chango\Jugo En Polvo Mango Y Naranja Bc 7 Gr_17.jpg
Jugo En Polvo Frutilla Y Limón Bc 7 Gr;$345,00;D:/python/scrapling/imagenes_productos_chango\Jugo En Polvo Frutilla Y Limón Bc 7 Gr_18.jpg
