Producto;Precio;Imagen
Carne Picada Swift Congelada 500 G;$7.789,00;D:/python/scrapling/imagenes_productos_chango\Carne Picada Swift Congelada 500 G_9.jpg
Costillitas De Cerdo 600 G;$9.199,00;D:/python/scrapling/imagenes_productos_chango\Costillitas De Cerdo 600 G_22.jpg
Bondiola Congelada 2.5 Kg;$10.900,00;D:/python/scrapling/imagenes_productos_chango\Bondiola Congelada 25 Kg_7.jpg
Chorizo En Gancho Alma Criolla 1 Kg;$12.390,00;D:/python/scrapling/imagenes_productos_chango\Chorizo En Gancho Alma Criolla 1 Kg_23.jpg
Carne Picada Especial 750 G;$14.699,00;D:/python/scrapling/imagenes_productos_chango\Carne Picada Especial 750 G_0.jpg
Cuadrada Feteada De Novillito Envasado Al Vacío 1 Kg;$14.899,00;D:/python/scrapling/imagenes_productos_chango\Cuadrada Feteada De Novillito Envasado A_1.jpg
Bola De Lomo Feteada De Novillito Envasado Al Vacío 1 Kg;$14.899,00;D:/python/scrapling/imagenes_productos_chango\Bola De Lomo Feteada De Novillito Envasa_2.jpg
Carne Picada Magra 650 G;$15.199,00;D:/python/scrapling/imagenes_productos_chango\Carne Picada Magra 650 G_15.jpg
Tortuguita De Novillo Envasado Al Vacío 900 G;$15.699,00;D:/python/scrapling/imagenes_productos_chango\Tortuguita De Novillo Envasado Al Vacío _17.jpg
Nalga Oferta Feteada Al Vacío 1 Kg;$15.899,00;D:/python/scrapling/imagenes_productos_chango\Nalga Oferta Feteada Al Vacío 1 Kg_14.jpg
