Producto;Precio;Imagen
Aceite Mezcla Cocinero 900 Ml;$2.899,00;D:/python/scrapling/imagenes_productos_chango\Aceite Mezcla Cocinero 900 Ml_14.jpg
Aceite Mezcla Siglo De Oro 900 Ml;$2.979,00;D:/python/scrapling/imagenes_productos_chango\Aceite Mezcla Siglo De Oro 900 Ml_16.jpg
Aceite De Girasol Natural 900 Ml;$3.149,25;D:/python/scrapling/imagenes_productos_chango\Aceite De Girasol Natural 900 Ml_6.jpg
Aceite En Aerosol Natura Con Aceite De Girasol 120 Ml;$3.314,25;D:/python/scrapling/imagenes_productos_chango\Aceite En Aerosol Natura Con Aceite De G_4.jpg
Aceite De Girasol Legítimo 900 Ml;$3.779,00;D:/python/scrapling/imagenes_productos_chango\Aceite De Girasol Legítimo 900 Ml_3.jpg
Aceite De Girasol Cañuelas 900 Ml;$3.799,00;D:/python/scrapling/imagenes_productos_chango\Aceite De Girasol Cañuelas 900 Ml_5.jpg
Aceite De Girasol Pureza 900 Ml;$4.209,00;D:/python/scrapling/imagenes_productos_chango\Aceite De Girasol Pureza 900 Ml_23.jpg
Aceite Fritolim Cocinero Clásico 120 G;$4.899,00;D:/python/scrapling/imagenes_productos_chango\Aceite Fritolim Cocinero Clásico 120 G_10.jpg
Aceite De Girasol Natura 1.5 L;$4.979,25;D:/python/scrapling/imagenes_productos_chango\Aceite De Girasol Natura 15 L_1.jpg
Aceite De Girasol Legítimo 1.5 L;$6.089,00;D:/python/scrapling/imagenes_productos_chango\Aceite De Girasol Legítimo 15 L_7.jpg
