Producto;Precio;Imagen
Medallon De Carne Vacuna Express 110 G 2u;$1.789,00;D:/python/scrapling/imagenes_productos_chango\Medallon De Carne Vacuna Express 110 G 2_9.jpg
Medallones De Carne Aliada 2 U 110 G;$2.159,00;D:/python/scrapling/imagenes_productos_chango\Medallones De Carne Aliada 2 U 110 G_16.jpg
Hamburguesas Paty Finas 2 U 110 G;$3.439,00;D:/python/scrapling/imagenes_productos_chango\Hamburguesas Paty Finas 2 U 110 G_22.jpg
Medallones De Merluza Grangys Con Espinaca Y Queso 430 G;$3.649,00;D:/python/scrapling/imagenes_productos_chango\Medallones De Merluza Grangys Con Espina_13.jpg
Medallones De Carne Vacuna Paty Express 276 G 4u;$4.469,25;D:/python/scrapling/imagenes_productos_chango\Medallones De Carne Vacuna Paty Express _5.jpg
Medallones Swift De Carne 276g 4u;$5.489,00;D:/python/scrapling/imagenes_productos_chango\Medallones Swift De Carne 276g 4u_6.jpg
Medallón Green Life De Calabaza Y Choclo 380 G 4u;$5.499,00;D:/python/scrapling/imagenes_productos_chango\Medallón Green Life De Calabaza Y Choclo_17.jpg
Medallón Green Life De Lentejas Y Zanahorias 380 G 4u;$5.499,00;D:/python/scrapling/imagenes_productos_chango\Medallón Green Life De Lentejas Y Zanaho_20.jpg
Medallones Granja Del Sol De Pollo 4 U;$6.006,75;D:/python/scrapling/imagenes_productos_chango\Medallones Granja Del Sol De Pollo 4 U_7.jpg
Hamburguesas Swift Clásicas 320g 4u;$6.329,25;D:/python/scrapling/imagenes_productos_chango\Hamburguesas Swift Clásicas 320g 4u_3.jpg
