Producto;Precio;Imagen
Papel Higiénico Aliada Simple Hoja 30 M 4u;$1.789,00;D:/python/scrapling/imagenes_productos_chango\Papel Higiénico Aliada Simple Hoja 30 M _4.jpg
Papel Hgiénico Check Simple Hoja 30 M X 10 Cm 4u;$2.019,00;D:/python/scrapling/imagenes_productos_chango\Papel Hgiénico Check Simple Hoja 30 M X _21.jpg
Papel Higiénico Higienol Fresh Hoja Simple 30 M 4 U;$2.459,00;D:/python/scrapling/imagenes_productos_chango\Papel Higiénico Higienol Fresh Hoja Simp_2.jpg
Papel Higiénico Felpita Hoja Simple 30 M 4 U;$2.599,00;D:/python/scrapling/imagenes_productos_chango\Papel Higiénico Felpita Hoja Simple 30 M_16.jpg
Papel Higienico Elegante Simple Hoja 30 M 6 U;$2.661,75;D:/python/scrapling/imagenes_productos_chango\Papel Higienico Elegante Simple Hoja 30 _9.jpg
Papel Higienico Elegante Blanco Hoja Simple 4u;$2.669,00;D:/python/scrapling/imagenes_productos_chango\Papel Higienico Elegante Blanco Hoja Sim_12.jpg
Papel Higiénico Felpita Premium Doble Hoja 4 U 20 M;$2.999,00;D:/python/scrapling/imagenes_productos_chango\Papel Higiénico Felpita Premium Doble Ho_10.jpg
Papel Higiénico Higienol Plus Doble Hoja 20 M 4 U;$3.389,00;D:/python/scrapling/imagenes_productos_chango\Papel Higiénico Higienol Plus Doble Hoja_20.jpg
Papel Higiénico Higienol Premium Doble Hoja 30 M 4 U;$3.411,85;D:/python/scrapling/imagenes_productos_chango\Papel Higiénico Higienol Premium Doble H_14.jpg
Papel Higiénico Check Doble Hoja 30 M X 10 Cm 4u;$3.759,00;D:/python/scrapling/imagenes_productos_chango\Papel Higiénico Check Doble Hoja 30 M X _23.jpg
