Producto;Precio;Imagen
Alimento Adulto Salmon Pouch Whiskas 85 Gr;$932,67;D:/python/scrapling/imagenes_productos_chango\Alimento Adulto Salmon Pouch Whiskas 85 _3.jpg
Alimento Gato Pavo Pocuh Whiskas 85 Gr;$932,67;D:/python/scrapling/imagenes_productos_chango\Alimento Gato Pavo Pocuh Whiskas 85 Gr_5.jpg
Alimento Adulto Pollo Pouch Whiskas 85 Gr;$932,67;D:/python/scrapling/imagenes_productos_chango\Alimento Adulto Pollo Pouch Whiskas 85 G_6.jpg
Alimento Adulto Sardina Pouch Whiskas 85 Gr;$932,67;D:/python/scrapling/imagenes_productos_chango\Alimento Adulto Sardina Pouch Whiskas 85_8.jpg
Alimento Adulto Carne Pouch Whiskas 85 Gr;$932,67;D:/python/scrapling/imagenes_productos_chango\Alimento Adulto Carne Pouch Whiskas 85 G_11.jpg
Alimento Humedo Pouch Pescado Souffle Whiskas 85gr;$932,67;D:/python/scrapling/imagenes_productos_chango\Alimento Humedo Pouch Pescado Souffle Wh_12.jpg
Alimento Húmedo Whiskas Para Gato Adulto Carne 85 G;$932,67;D:/python/scrapling/imagenes_productos_chango\Alimento Húmedo Whiskas Para Gato Adulto_18.jpg
Alimento Humedo Gato Salmon Rosado Pets Class X85gr;$1.159,00;D:/python/scrapling/imagenes_productos_chango\Alimento Humedo Gato Salmon Rosado Pets _10.jpg
Alimento Humedo  Gato Carne Pets Class X 85 Grs;$1.159,00;D:/python/scrapling/imagenes_productos_chango\Alimento Humedo  Gato Carne Pets Class X_13.jpg
Alimento Humedo Gatos Felix Salmon 100 Gr;$1.449,00;D:/python/scrapling/imagenes_productos_chango\Alimento Humedo Gatos Felix Salmon 100 G_20.jpg
