Producto;Precio;Imagen
Aceite Mezcla Siglo De Oro 900 Ml;$2.979,00;D:/python/scrapling/imagenes_productos_chango\Aceite Mezcla Siglo De Oro 900 Ml_17.jpg
Aceite Mezcla Cocinero 900 Ml;$3.239,00;D:/python/scrapling/imagenes_productos_chango\Aceite Mezcla Cocinero 900 Ml_15.jpg
Aceite En Aerosol Cañuelas Oliva 150 Ml;$3.239,00;D:/python/scrapling/imagenes_productos_chango\Aceite En Aerosol Cañuelas Oliva 150 Ml_18.jpg
Aceite De Girasol Legítimo 900 Ml;$3.779,00;D:/python/scrapling/imagenes_productos_chango\Aceite De Girasol Legítimo 900 Ml_3.jpg
Aceite De Girasol Cocinero 900 Ml;$4.089,00;D:/python/scrapling/imagenes_productos_chango\Aceite De Girasol Cocinero 900 Ml_5.jpg
Aceite De Girasol Cañuelas 900 Ml;$4.119,00;D:/python/scrapling/imagenes_productos_chango\Aceite De Girasol Cañuelas 900 Ml_7.jpg
Aceite De Girasol Natural 900 Ml;$4.409,00;D:/python/scrapling/imagenes_productos_chango\Aceite De Girasol Natural 900 Ml_6.jpg
Aceite En Aerosol Natura Con Aceite De Girasol 120 Ml;$4.419,00;D:/python/scrapling/imagenes_productos_chango\Aceite En Aerosol Natura Con Aceite De G_4.jpg
Aceite Fritolim Cocinero Clásico 120 G;$4.899,00;D:/python/scrapling/imagenes_productos_chango\Aceite Fritolim Cocinero Clásico 120 G_11.jpg
Aceite De Girasol Cañuelas 1.5 L;$5.649,00;D:/python/scrapling/imagenes_productos_chango\Aceite De Girasol Cañuelas 15 L_0.jpg
